{
  "version": 1,
  "provider_id": "google-vertex",
  "route_name": "google-vertex",
  "display_name": "Google Vertex AI",
  "auth": {
    "kind": "gcp-service-account",
    "requirements": ["service_account", "vertex_project_id"]
  },
  "transport": {
    "kind": "vertex",
    "runtime_adapter": "google_vertex"
  },
  "catalog": {
    "bootstrap": {
      "models": [
        {
          "model_id": "gemini-3.1-pro-preview",
          "display_name": "Gemini 3.1 Pro Preview",
          "capabilities": ["chat", "streaming", "tools"],
          "lifecycle": "preview",
          "upstream_id": "gemini-3.1-pro-preview",
          "metadata": {
            "provider_id": "google-vertex",
            "transport": "vertex",
            "billing_profile": "gcp"
          }
        },
        {
          "model_id": "gemini-3-flash-preview",
          "display_name": "Gemini 3 Flash Preview",
          "capabilities": ["chat", "streaming", "tools"],
          "lifecycle": "preview",
          "upstream_id": "gemini-3-flash-preview",
          "metadata": {
            "provider_id": "google-vertex",
            "transport": "vertex",
            "billing_profile": "gcp"
          }
        },
        {
          "model_id": "gemini-2.5-pro",
          "display_name": "Gemini 2.5 Pro",
          "capabilities": ["chat", "streaming", "tools"],
          "lifecycle": "ga",
          "upstream_id": "gemini-2.5-pro",
          "metadata": {
            "provider_id": "google-vertex",
            "transport": "vertex",
            "billing_profile": "gcp"
          }
        },
        {
          "model_id": "gemini-2.5-flash",
          "display_name": "Gemini 2.5 Flash",
          "capabilities": ["chat", "streaming", "tools"],
          "lifecycle": "ga",
          "upstream_id": "gemini-2.5-flash",
          "metadata": {
            "provider_id": "google-vertex",
            "transport": "vertex",
            "billing_profile": "gcp"
          }
        },
        {
          "model_id": "gemini-2.5-flash-lite",
          "display_name": "Gemini 2.5 Flash Lite",
          "capabilities": ["chat", "streaming", "tools"],
          "lifecycle": "ga",
          "upstream_id": "gemini-2.5-flash-lite",
          "metadata": {
            "provider_id": "google-vertex",
            "transport": "vertex",
            "billing_profile": "gcp"
          }
        },
        {
          "model_id": "gemini-3-pro-image-preview",
          "display_name": "Gemini 3 Pro Image Preview",
          "capabilities": ["chat", "image"],
          "lifecycle": "preview",
          "upstream_id": "gemini-3-pro-image-preview",
          "metadata": {
            "provider_id": "google-vertex",
            "transport": "vertex",
            "billing_profile": "gcp"
          }
        },
        {
          "model_id": "gemini-2.5-flash-image",
          "display_name": "Gemini 2.5 Flash Image",
          "capabilities": ["chat", "image"],
          "lifecycle": "ga",
          "upstream_id": "gemini-2.5-flash-image",
          "metadata": {
            "provider_id": "google-vertex",
            "transport": "vertex",
            "billing_profile": "gcp"
          }
        },
        {
          "model_id": "nano-banana",
          "display_name": "Nano Banana",
          "capabilities": ["chat", "image"],
          "lifecycle": "ga",
          "upstream_id": "gemini-2.5-flash-image",
          "metadata": {
            "provider_id": "google-vertex",
            "transport": "vertex",
            "billing_profile": "gcp"
          }
        }
      ]
    },
    "discovery": {
      "enabled": false
    },
    "cache": {
      "snapshot_enabled": false
    }
  }
}
